{
  "$schema": "https://json-schema.org/draft/2020-12/schema",
  "$id": "https://github.com/boardfarmdevs/emosa-lab/schemas/fleet-config.schema.json",
  "title": "EMOSA fleet configuration",
  "description": "The front port every pod is handed to, and the settings every agent it creates inherits.",
  "type": "object",
  "additionalProperties": false,
  "required": ["listen", "advertise", "ports", "controller_al", "state_root", "config_dir"],
  "properties": {
    "listen": {"type": "string", "pattern": "^(ptcp:[0-9]{1,5}:[0-9.]+|punix:/.+)$", "description": "The front port (OVSDB, passive)."},
    "advertise": {"type": "string", "minLength": 1, "description": "Host the pods reach agent ports on; manager_addr becomes tcp:ADVERTISE:PORT."},
    "forward": {"type": "boolean", "description": "The package's forwarder (emosa-forward-c) exposes the front port and the agent ports, which listen on loopback, on the advertise address (an IPv4 address, a gateway's LAN address) where the pods reach them. Default false: another forwarder does (in the labs, an LXD proxy)."},
    "ports": {"type": "array", "prefixItems": [{"type": "integer", "minimum": 1, "maximum": 65535}, {"type": "integer", "minimum": 1, "maximum": 65535}], "minItems": 2, "maxItems": 2, "description": "First and last agent port (inclusive)."},
    "controller_al": {"type": "string", "pattern": "^[0-9a-f]{2}(:[0-9a-f]{2}){5}$"},
    "message_set": {"enum": ["easymesh-6.1", "r1"]},
    "multi_bss": {"type": "boolean"},
    "m2_session": {"enum": ["distinct", "shared"]},
    "profile": {"type": "string", "minLength": 1},
    "uplink": {
      "type": "object",
      "additionalProperties": false,
      "required": ["mode"],
      "description": "Given to every agent. Data plane option 1: the agent switches the pod's backhaul station onto the EasyMesh backhaul (data-plane.md §5.3, spec §8). Mode ethernet: a wired pod's uplink port bridged into br-home (spec §8.4). Absent or mode off: the pod keeps its OpenSync uplink (option 2).",
      "properties": {
        "mode": {"enum": ["off", "multi-ap", "ethernet", "gre"], "description": "multi-ap: option 1 (spec §8.3); ethernet: a wired pod, its Ethernet uplink bridged into the fronthaul's bridge (spec §8.4); gre: a GRE-parent child steered onto a parent AP by BSSID, no configured upstream (spec §8.6)."},
        "port": {"type": "string", "pattern": "^[A-Za-z0-9._-]{1,15}$", "default": "eth1", "description": "With mode ethernet: the pod's Ethernet uplink port."},
        "credentials": {"enum": ["m2", "config"], "default": "m2", "description": "m2: the backhaul BSS of the controller's applied M2 set (multi_bss); config: ssid and secret_ref below."},
        "ssid": {"type": "string", "minLength": 1, "maxLength": 32},
        "secret_ref": {"type": "string", "pattern": "^[A-Za-z0-9][A-Za-z0-9_.-]{0,95}$", "description": "A file in the agent's secret directory (state_dir/secrets), mode 0600."},
        "station": {"type": "string", "pattern": "^[A-Za-z0-9._-]{1,15}$", "description": "Overrides the profile's uplink station."},
        "bootstrap": {"type": "object", "additionalProperties": false, "required": ["ssid", "secret_ref"], "description": "A legacy pod's station on the site's GTP BSS (spec 3.10, the GTP station): written once per start of its OpenSync while the station has no row. Any mode a legacy pod serves.", "properties": {"ssid": {"type": "string", "minLength": 1, "maxLength": 32, "description": "The GTP BSS's SSID."}, "secret_ref": {"type": "string", "pattern": "^[A-Za-z0-9][A-Za-z0-9_.-]{0,95}$", "description": "Its WPA2-PSK passphrase: a file in the agent's secret directory (state_dir/secrets), mode 0600."}, "bssid": {"type": "string", "pattern": "^[0-9A-Fa-f]{2}(:[0-9A-Fa-f]{2}){5}$", "description": "A pin to one GTP BSS (parent), none by default: a pinned pod stays on that BSS when the site's GTP BSS changes."}, "unassociated_seconds": {"type": "integer", "minimum": 1, "description": "The station's guard: the station in EMOSA's form not associated this long is deleted (spec 3.10: the pods' vendor healthcheck reboots a pod after ten minutes of an unassociated station). 300 by default."}, "retry_seconds": {"type": "array", "minItems": 1, "maxItems": 3, "items": {"type": "integer", "minimum": 1}, "description": "The back-off before the station is written again after each removal, the last repeated: 900, 1800, 3600 by default; back to the first once a write associates."}}},
        "bssid": {"type": "string", "pattern": "^[0-9A-Fa-f]{2}(:[0-9A-Fa-f]{2}){5}$", "description": "The upstream backhaul BSS the station is pinned to, required with mode multi-ap. Never one of the pod's own BSSIDs: a station on its own backhaul BSS loops br-home."},
        "hold_backoff": {"type": "integer", "minimum": 10, "maximum": 86400, "default": 600, "description": "Seconds a failed switch holds the pod on option 2 before the switch is made again (spec §8.3), doubled with each held retry."},
        "hold_backoff_cap": {"type": "integer", "minimum": 10, "maximum": 604800, "default": 9600, "description": "The longest hold between two retries, in seconds."}
      }
    },
    "telemetry": {"type": "object", "additionalProperties": false, "required": ["mode"], "description": "Given to every agent (each subscribes to its own pod's topic). The pod's own statistics (spec §3.6): the agent sets the pod's MQTT settings and a raw client report once per OpenSync start, and subscribes to the pod's topic. Absent or mode off: the agent leaves the pod's statistics publishing alone.", "properties": {"mode": {"enum": ["off", "mqtt"]}, "broker": {"type": "string", "minLength": 1, "maxLength": 253, "pattern": "^[^ /:]+$", "description": "Broker host the pod connects to (mutual TLS with its device certificate)."}, "port": {"type": "integer", "minimum": 1, "maximum": 65535, "default": 8883}, "topic": {"type": "string", "minLength": 1, "maxLength": 128, "pattern": "^[^#+]+$", "description": "Default emosa/stats/<serial>."}, "subscribe": {"type": "string", "pattern": "^[^ ]+:[0-9]{1,5}$", "default": "127.0.0.1:1883", "description": "host:port where the agent reads the pod's topic."}, "radio_type": {"enum": ["2.4G", "5G", "5GL", "5GU", "6G"], "default": "2.4G"}, "reporting_interval": {"type": "integer", "minimum": 1, "maximum": 3600, "default": 10}, "sampling_interval": {"type": "integer", "minimum": 1, "maximum": 3600, "default": 5}, "publish_interval": {"type": "integer", "minimum": 1, "maximum": 3600, "description": "qm's publish interval in seconds (mqtt_settings agg_stats_interval). Absent: OpenSync's default, 60 s."}, "survey": {"type": "boolean", "default": false, "description": "Also a raw on-channel survey of the radio (channel utilization for AP metrics, spec 3.8)."}}},
    "topology_query_window": {"type": "integer", "minimum": 10, "maximum": 3600, "description": "Given to every agent: a property of the controller (spec §2.5). Absent: the rule is off."},
    "gtp_underlay": {"type": "string", "pattern": "^169\\.254\\.(25[0-5]|2[0-4][0-9]|1[0-9][0-9]|[1-9]?[0-9])\\.(25[0-5]|2[0-4][0-9]|1[0-9][0-9]|[1-9]?[0-9])/(1[6-9]|2[0-9]|3[0-2])$", "description": "The site's own GTP underlay (spec 8.2), such as 169.254.1.0/24: given, the registry allocates each pod an underlay for its role as a GRE parent (spec 8.6), a 169.254.N.0/24 that never overlaps this one. Absent: none."},
    "state_root": {"type": "string", "minLength": 1},
    "secrets": {"type": "string", "minLength": 1, "description": "The fleet's own secret store (a directory, mode 0700, one private file per reference): a secret_ref an agent configuration names (its uplink's, its GTP station's) that the agent's store lacks is copied from here when the fleet writes the configuration; never replaced, never logged by value (spec 4)."},
    "run_root": {"type": "string", "minLength": 1, "description": "Each agent's run directory is run_root/<pod_id> (its status, on a RAM disk on a gateway). Absent: the agents write their status in their state directories."},
    "config_dir": {"type": "string", "minLength": 1},
    "admit": {"oneOf": [{"const": "*"}, {"type": "array", "items": {"type": "string", "minLength": 1, "maxLength": 64}}], "default": "*"},
    "concurrency": {"type": "integer", "minimum": 1, "maximum": 256, "default": 16},
    "agents": {"enum": ["systemd", "supervised"], "default": "systemd", "description": "How the agents run (spec §4). systemd: an emosa-agent@POD unit each, enabled and started by the fleet. supervised: the C fleet's own children, for a system without systemd (a router's busybox init): the link helper, then the agent, with /etc/default/emosa and /etc/default/emosa-POD in their environment, started again 3 s after one ends, stopped when its pod is forgotten and when the fleet ends; each one's output in LOG_ROOT/POD/agent.log (the run root, else the state root), kept to two files of 256 KiB. Absent: EMOSA_AGENTS from the fleet's environment or /etc/default/emosa, else systemd."},
    "pods": {
      "type": "object",
      "description": "Per-pod overrides of the agent settings above, by serial number.",
      "propertyNames": {"pattern": "^[A-Za-z0-9._-]{1,64}$"},
      "additionalProperties": {
        "type": "object",
        "additionalProperties": false,
        "properties": {
          "message_set": {"enum": ["easymesh-6.1", "r1"]},
          "multi_bss": {"type": "boolean"},
          "m2_session": {"enum": ["distinct", "shared"]},
          "profile": {"type": "string", "minLength": 1},
          "uplink": {"$ref": "#/properties/uplink"},
          "telemetry": {"$ref": "#/properties/telemetry"}
        }
      }
    },
    "database": {"type": "string", "default": "Open_vSwitch"},
    "vif": {"type": "string", "deprecated": true, "description": "Ignored; the fronthaul VIF comes from the profile."}
  }
}
